{
  "$schema": "argus/technique-catalog@1",
  "schemaVersion": 1,
  "catalogId": "argus/technique-catalog/antigone@1",
  "role": "antigone",
  "catalogType": "hunter",
  "valuePolicy": "discover-never-assume",
  "executionRule": "each-applicable-entry-covered-or-gap",
  "absentSurfaceDisposition": "not-applicable-with-evidence",
  "entries": [
    {
      "id": "ANG-T01",
      "title": "Programmatic accessible name on every form control",
      "scope": ["form-controls"],
      "techniques": ["checklist-based-testing", "equivalence-partitioning"],
      "appliesWhen": "surface-present",
      "construct": ["Walk every form on every screen, including admin and operator panels, and list each input, select, textarea, custom combobox, checkbox and radio group from the accessibility tree", "Read each control's computed accessible name and its source: label for, wrapping label, aria-labelledby or aria-label; a visible adjacent text node that is not programmatically bound supplies no name", "Read the required state and the instruction and error association of each control: required or aria-required, and aria-describedby pointing at the inline instruction or error", "Read the autocomplete token of every field that collects information about the user"],
      "oracles": ["Every control exposes a programmatic accessible name that identifies its purpose (1.3.1 Info and Relationships, 3.3.2 Labels or Instructions, 4.1.2 Name, Role, Value); a control named only by an unbound visual caption, or by a placeholder that vanishes on input, is a defect", "A radio or checkbox group exposes its group label, required state is exposed programmatically, and each inline error is associated with the field it describes", "A field that collects information about the user carries the matching autocomplete token (1.3.5 Identify Input Purpose)"],
      "routes": ["accessibility"]
    },
    {
      "id": "ANG-T02",
      "title": "Keyboard operability of every interactive element, including non-semantic widgets",
      "scope": ["keyboard", "custom-widget"],
      "techniques": ["checklist-based-testing", "state-transition"],
      "appliesWhen": "always",
      "construct": ["Drive every primary screen with Tab, Shift+Tab, Enter, Space, Escape and the arrow keys only, with no pointer input", "List every element a pointer user can activate, including clickable div and span elements, answer options, star ratings and custom toggles, and match each against the keyboard focus sequence", "Activate each reachable element from the keyboard and read the resulting state from the accessibility tree or the page, so a focusable element that does nothing is caught"],
      "oracles": ["Every function available to a pointer is reachable and operable from the keyboard alone and the action fires (2.1.1 Keyboard); a non-semantic control that cannot take focus or cannot be operated with Enter or Space is a defect", "Focus can always leave every component with standard keys, except a correctly managed modal that releases focus on close (2.1.2 No Keyboard Trap)", "Each custom control exposes a role and state that match its behaviour (4.1.2 Name, Role, Value)"],
      "routes": ["accessibility", "ui"]
    },
    {
      "id": "ANG-T03",
      "title": "Modal dialog focus lifecycle",
      "scope": ["modal-dialog", "focus-management"],
      "techniques": ["state-transition"],
      "appliesWhen": "surface-present",
      "construct": ["Open every dialog, drawer and overlay from the keyboard and record where focus lands", "Tab and Shift+Tab past the last and the first focusable element of the open dialog, then press Escape", "Close the dialog through each of its close paths, including Escape, the close button, confirm and cancel, and record where focus lands each time"],
      "oracles": ["Focus moves into the dialog on open, stays inside it while it is modal, and Escape closes it (2.1.2 No Keyboard Trap, 2.4.3 Focus Order)", "On every close path focus returns to the trigger or to the next logical element, never to the document start or to an element removed from the page", "The dialog exposes a dialog role, an accessible name and its modal state, and content behind it is not reachable while it is open (4.1.2 Name, Role, Value)"],
      "routes": ["accessibility", "ui"]
    },
    {
      "id": "ANG-T04",
      "title": "Status messages announced for dynamic results",
      "scope": ["live-region", "dynamic-content"],
      "techniques": ["checklist-based-testing", "state-transition"],
      "appliesWhen": "surface-present",
      "construct": ["Enumerate every dynamic update that happens without a focus change: search result counts, no-results messages, cart, enrolment and assessment results, save confirmations and asynchronous errors", "Trigger each update from the keyboard and read the live-region markup that carries it: role status, alert or log, or an aria-live container present in the tree before the update"],
      "oracles": ["Every status message that does not take focus is exposed through a live region so assistive technology announces it (4.1.3 Status Messages); a silent dynamic update is a defect", "A live region injected together with its content, or one hidden from the accessibility tree, counts as silent"],
      "routes": ["accessibility"]
    },
    {
      "id": "ANG-T05",
      "title": "Announced content matches the new state",
      "scope": ["live-region", "form-validation"],
      "techniques": ["state-transition", "equivalence-partitioning"],
      "appliesWhen": "surface-present",
      "construct": ["After each dynamic event, including a result count, no results, a validation error and an asynchronous success or failure, capture the live-region text with --eval before and after the event", "Compare the announced text with the rendered state: the announced count against the rendered item count, and the no-results message against a result set that is actually empty", "Submit each form with one invalid field at a time and then with every field valid, and capture the announced and associated error text", "Take the expected message family from the specification or the error catalogue, never from a hard-coded literal"],
      "oracles": ["The announcement reflects the actual new state; a stale, hard-coded or contradictory announcement is as broken as a silent one (4.1.3 Status Messages)", "A field error names the offending field and the rule it broke, not a generic failure message (3.3.1 Error Identification, 3.3.3 Error Suggestion)", "A change of state with no announcement, including a silent success, is a defect"],
      "routes": ["accessibility", "ui"]
    },
    {
      "id": "ANG-T06",
      "title": "Live-region politeness and announcement at documented boundaries",
      "scope": ["live-region"],
      "techniques": ["decision-table", "boundary-value-analysis", "state-transition"],
      "appliesWhen": "surface-present",
      "construct": ["Build the decision table politeness {polite, assertive, off} x update {routine count, blocking error, success} from the live regions found on each screen", "Where a count or progress value crosses a documented boundary that changes the message family, such as last item remaining, limit reached, from N or after N, construct the count at N-1, N and N+1 and capture each announcement"],
      "oracles": ["Each update uses the documented politeness pairing: a blocking error interrupts, while a routine count neither seizes focus nor interrupts speech (4.1.3 Status Messages)", "The announced message family switches exactly at the documented boundary under its inclusive or exclusive rule; the equality point is asserted, not only the interior"],
      "routes": ["accessibility"]
    },
    {
      "id": "ANG-T07",
      "title": "Focus indicator survives at the suppression boundary",
      "scope": ["focus-management", "visual-contrast"],
      "techniques": ["boundary-value-analysis", "equivalence-partitioning"],
      "appliesWhen": "always",
      "construct": ["Reach every interactive element with Tab, never with the pointer, because :focus-visible differs from :focus under pointer input", "With --eval read the computed outline, outline-width, outline-color, box-shadow, border and background at :focus and at :focus-visible across the default, hover, active, disabled-but-focusable and focus-within container states", "Where the native outline is suppressed, identify the replacement indicator and measure its contrast against the adjacent colours"],
      "oracles": ["Every keyboard-focusable element shows a visible focus indicator (2.4.7 Focus Visible); outline none, a zero width or a transparent colour with no compensating box-shadow, border or background change is a defect", "A replacement indicator meets the selected standard's non-text contrast threshold against the adjacent colours (1.4.11 Non-text Contrast); the replacement is measured, never assumed"],
      "routes": ["accessibility", "ui"]
    },
    {
      "id": "ANG-T08",
      "title": "Bypass blocks, page title, headings and landmarks",
      "scope": ["document-structure"],
      "techniques": ["checklist-based-testing"],
      "appliesWhen": "always",
      "construct": ["On every page type, including deep operator, admin and player pages, read the page title, the heading outline and the landmark set from the accessibility tree", "Press Tab once after page load, follow the first focusable element, activate any skip link and record where focus lands"],
      "oracles": ["A mechanism bypasses the blocks repeated on multiple pages, and a skip link moves focus to the main content rather than only scrolling (2.4.1 Bypass Blocks)", "Each page has a title that describes its topic or purpose (2.4.2 Page Titled), one main landmark, and a heading outline with a first-level heading and no skipped level (1.3.1 Info and Relationships, 2.4.6 Headings and Labels)"],
      "routes": ["accessibility"]
    },
    {
      "id": "ANG-T09",